Question,Answer
Недавно я получила государственную услугу и мне пришло SMS-сообщение с просьбой оценить  asdкачество  asdпредоставленной государственной услуги по пятибалльной шкале. Что я должна написать в ответном сообщении и является ли оно бесплатным для меня?,"Постановлением Правительства РФ от 12.12.2012 г. № 1284 определены основные критерии и порядок оценки гражданами эффективности деятельности руководителей территориальных органов федеральных органов исполнительной власти (их структурных подразделений) и территориальных органов государственных внебюджетных фондов (их региональных отделений) с учетом качества предоставления ими государственных услуг, а  также применения результатов указанной оценки как основания для принятия решений о  досрочном прекращении исполнения руководителями своих должностных обязанностей.В целях реализации положений указанного постановления Правительства, на территории РФ разработана и введена в эксплуатацию информационно-аналитическая система мониторинга качества государственных услуг (ИАС МКГУ).ИАС МКГУ аккумулирует оценки и мнения граждан о качестве полученных ими государственных услуг, на основании которых осуществляется анализ качества предоставления услуг и расчет показателей эффективности деятельности руководителей территориальных органов федеральных органов власти и государственных внебюджетных фондов.Механизм оценки распространен на социально значимые и массовые федеральные государственные услуги МВД России, ФНС России, Росреестра, Пенсионного фонда Российской Федерации, Фонда социального страхования Российской Федерации, Росгвардии, ФССП России, Росимущества и Роспотребнадзора, оказание которых осуществляется через территориальные органы ведомств и МФЦ.Государственные услуги оцениваются по следующим каналам:- личные мобильные телефоны (смс-опросы и телефонные опросы граждан, отрицательно оценивших качество предоставленных им государственных услуг);- терминальные и иные устройства, расположенные в территориальных органах ведомств, а также в МФЦ;- сеть Интернет (Единый портал госуслуг, официальные сайты ведомств, сайт «Ваш контроль»).На сайте «Ваш контроль» (https://vashkontrol.ru) гражданину предоставлена возможность разместить отзыв о качестве предоставления государственной услуги."
"Мой бывший муж получил свидетельство о расторжении брака, а я не получила. Скажите, нужно ли мне самой получать свидетельство или будет достаточно документа супруга?","Вам необходимо получить свой документ о государственной регистрации расторжения брака. Предоставление государственной услуги по государственной регистрации расторжения брака начинается подачей лицами (лицом), расторгающими брак, заявления о расторжении брака и оканчивается выдачей каждому из заявителей свидетельства о расторжении брака с одновременным проставлением каждому штампов о расторжении брака в паспорте РФ в день составления органом ЗАГС записи акта о расторжении брака. Свидетельства о расторжении брака являются именными документами, поэтому представление одним лицом, расторгнувшим брак, в подтверждение расторжения брака свидетельства о расторжении брака, выданного на имя другого лица, противоречит действующему законодательству. Согласно пункту 2 статьи 25 Семейного кодекса Российской Федерации супруги не вправе вступить в новый брак до получения свидетельства о расторжении брака в органе ЗАГС по месту жительства любого из них или по месту государственной регистрации заключения брака.  "
Какая очередь в детский сад?,"Данную информацию Вы можете уточнить по телефону Комитета образования администрации городского округа «Город Чита» 32-41-13, либо на сайте Комитета образования администрации городского округа «Город Чита» https://edu-chita.ru/. Так же Вы можете лично обратиться в Центр 'Мои документы', предоставив паспорт гражданина РФ и свидетельство о рождении ребенка.Для самостоятельного получения информации о позиции ребенка в очереди на получение места в детский сад, без посещения МФЦ, необходимо:1.Зайти на сайт Комитета образования;2.В верхней части страницы зайти в раздел E-услуги, после перенаправления на сайт «Электронные услуги в сфере образования» выбрать «Поиск заявлений»;3.Выбрать муниципалитет, выбрать поиск по номеру заявления или по документам ребенка;4. Ввести номер Вашего обращения (заявления) 76401/33/******** (* цифры Вашего заявления после знака «/», где ЗЗ – это БУКВЫ, не цифры) или серию и номер документа ребенка;4.Далее выбрать «Найти заявление».  "
Можно ли в МФЦ получить сведения о налоговой задолженности и в случае её наличия получить квитанцию для ее погашения? ,"При получении государственных и муниципальных услуг в Центре 'Мои документы' Вы можете узнать о наличии или отсутствии у Вас налоговой задолженности по транспортному, земельному налогам, налогу на имущество физических лиц и, в случае её наличия, получить распечатанную квитанцию для погашения этой задолженности без личного визита в налоговую инспекцию. Для получения данной услуги при себе необходимо иметь паспорт, ИНН. Произвести оплату Вы можете: в банке по квитанции, на сайте налоговой службы nalog.ru посредством сервиса «Заплати налоги» или через «Личный кабинет».  "
"Хочу вернуть девичью фамилию после развода, какие документы нужны и сумма гос пошлины?","В том случае, если при расторжении брака Вы не сменили фамилию и желаете это сделать сейчас, Вам необходимо обратиться в Отдел ЗАГС по месту Вашего жительства с заявлением о перемени имени. Впоследствии в центре 'Мои Документы' Вы сможете заменить паспорт, для этого необходимо подготовить следующий пакет документов:1. Заявление о выдаче (замене) паспорта по форме № 1П – заполняется на месте;2. Две личные фотографии в черно-белом или цветном исполнении  размером 35 х 45 мм;3. Паспорт гражданина РФ,4. Свидетельство о перемени имени;5. Квитанция оплаты государственной пошлины в размере – 300 рублей;6. Документы, необходимые для проставления обязательных отметок в паспорте:- документы воинского учета (при наличии соответствующего основания),- свидетельства о рождении детей, не достигших 14-летнего возраста (при наличии),- документы, подтверждающие регистрацию по месту жительства (при наличии регистрации по месту жительства).Паспорт РФ оформляется в 10-дневный срок в случае обращения гражданина по месту жительства, в 30-дневный срок в случае обращения гражданина по вопросу выдачи или замены паспорта не по месту жительства.После замены паспорта гражданина РФ в центре 'Мои Документы' Вы также можете заменить СНИЛС, ИНН, медицинский полис, водительское удостоверение.Центр «Мои документы» расположен по адресам: г. Чита, ул. Генерала Белика, 12 и ул. Бутина, 72. Режим работы Центра: понедельник, среда, четверг, пятница, суббота с 8-00 до 18-00, вторник с 8-00 до 20-00, без технических и обеденного перерывов. Обращаем Ваше внимание на то, что первая и вторая пятница месяца не приемный день в одном из филиалов, поэтому перед посещением Центра рекомендуем Вам уточнить график работы по телефону Центра телефонного обслуживания 8(3022)21-10-10. Дополнительно сообщаем, что на площадке Центра доступны услуги в порядке предварительной записи, подробности Вы можете уточнить по вышеуказанному телефону."
"Нужно прописать временно сына, но после травмы он не ходит и не может писать. Я собственница квартиры, находится он в этой квартире. Подскажите что нужно делать?","МФЦ предоставляет услуги по выезду работника на дом на платной или безвозмездной основе (при наличии льготы). К льготным категориям граждан в соответствии с постановлением Правительства Забайкальского края от 16.02.2015 г. № 51  относятся:- инвалиды I, II групп, дети-инвалиды;- ветераны и инвалиды Великой Отечественной войны, члены семей погибших (умерших) ветеранов и инвалидов Великой Отечественной войны, имеющие право на предоставление мер социальной поддержки в соответствии с Федеральным законом от 12 января 1995 года № 5-ФЗ «О ветеранах»;- Герои Российской Федерации, Герои Советского Союза, Герои Социалистического Труда, Герои Труда Российской Федерации. Для организации выезда Вам необходимо подать заявку одним  из способов:- через личное обращение заявителя  к администраторам МФЦ- через обращение в Центр телефонного обслуживания по номеру 8(3022)21-10-10-  на официальном сайте МФЦ (www.mfc-chita.ru) – во вкладке «Платный выезд МФЦ».Перечень документов для регистрации по месту пребывания:1. Заявление о регистрации по месту пребывания по форме N 1; 2. Документ, удостоверяющий личность заявителя; 3. Документ, являющийся основанием для временного проживания гражданина в жилом помещении: договор найма  (поднайма), договор социального найма жилого помещения, свидетельство о государственной регистрации права на жилое помещение, выписка из ЕГРН и т.д.4. Копия свидетельства о рождении - на регистрацию по месту пребывания детей, не достигших 14-летнего возраста;5. На граждан, которым регистрация по месту пребывания осуществляется на срок девять месяцев и более, заполняются листки статистического учета прибытия по форме N 12П. В случае невозможности подписать заявление совершеннолетним заявителем в силу заболевания, сотрудник убеждается в согласии гражданина на регистрацию по месту пребывания по указанному адресу, в графе «подпись» проставляется прочерк, указывается «получено устное согласие» и заверяется подписью специалиста.  Если Ваш сын не достиг 14-летнего возраста, Вы можете самостоятельно обратиться как законный представитель в ближайший офис МФЦ или отдел УМВД по месту планируемой регистрации по месту пребывания."
